[
  {
    "id": "class:cgm.callgraph.CallGraphExtractor",
    "kind": "class",
    "path": "L:\\AIOS\\tools\\codegraph_mapper\\cgm\\callgraph.py",
    "name": "CallGraphExtractor",
    "qualname": "cgm.callgraph.CallGraphExtractor",
    "span": {
      "start": {
        "line": 10,
        "col": 0
      },
      "end": {
        "line": 73,
        "col": 20
      }
    },
    "doc": "Builds intra-file call graph from AST",
    "meta": {
      "decorators": []
    }
  },
  {
    "id": "class:cgm.emit_csv.CSVEmitter",
    "kind": "class",
    "path": "L:\\AIOS\\tools\\codegraph_mapper\\cgm\\emit_csv.py",
    "name": "CSVEmitter",
    "qualname": "cgm.emit_csv.CSVEmitter",
    "span": {
      "start": {
        "line": 12,
        "col": 0
      },
      "end": {
        "line": 85,
        "col": 91
      }
    },
    "doc": "Emits graph data as CSV files",
    "meta": {
      "decorators": []
    }
  },
  {
    "id": "class:cgm.emit_dot.DOTEmitter",
    "kind": "class",
    "path": "L:\\AIOS\\tools\\codegraph_mapper\\cgm\\emit_dot.py",
    "name": "DOTEmitter",
    "qualname": "cgm.emit_dot.DOTEmitter",
    "span": {
      "start": {
        "line": 11,
        "col": 0
      },
      "end": {
        "line": 129,
        "col": 64
      }
    },
    "doc": "Emits graph as Graphviz DOT format",
    "meta": {
      "decorators": []
    }
  },
  {
    "id": "class:cgm.emit_json.JSONEmitter",
    "kind": "class",
    "path": "L:\\AIOS\\tools\\codegraph_mapper\\cgm\\emit_json.py",
    "name": "JSONEmitter",
    "qualname": "cgm.emit_json.JSONEmitter",
    "span": {
      "start": {
        "line": 11,
        "col": 0
      },
      "end": {
        "line": 75,
        "col": 22
      }
    },
    "doc": "Emits graph data as JSON files",
    "meta": {
      "decorators": []
    }
  },
  {
    "id": "class:cgm.emit_mermaid.MermaidEmitter",
    "kind": "class",
    "path": "L:\\AIOS\\tools\\codegraph_mapper\\cgm\\emit_mermaid.py",
    "name": "MermaidEmitter",
    "qualname": "cgm.emit_mermaid.MermaidEmitter",
    "span": {
      "start": {
        "line": 11,
        "col": 0
      },
      "end": {
        "line": 94,
        "col": 59
      }
    },
    "doc": "Emits graph as Mermaid diagram",
    "meta": {
      "decorators": []
    }
  },
  {
    "id": "class:cgm.fs_walk.FileInventory",
    "kind": "class",
    "path": "L:\\AIOS\\tools\\codegraph_mapper\\cgm\\fs_walk.py",
    "name": "FileInventory",
    "qualname": "cgm.fs_walk.FileInventory",
    "span": {
      "start": {
        "line": 14,
        "col": 0
      },
      "end": {
        "line": 139,
        "col": 41
      }
    },
    "doc": "Builds file inventory with hashes and metadata",
    "meta": {
      "decorators": []
    }
  },
  {
    "id": "class:cgm.graph_build.GraphBuilder",
    "kind": "class",
    "path": "L:\\AIOS\\tools\\codegraph_mapper\\cgm\\graph_build.py",
    "name": "GraphBuilder",
    "qualname": "cgm.graph_build.GraphBuilder",
    "span": {
      "start": {
        "line": 14,
        "col": 0
      },
      "end": {
        "line": 197,
        "col": 12
      }
    },
    "doc": "Builds complete code graph from file inventory",
    "meta": {
      "decorators": []
    }
  },
  {
    "id": "class:cgm.imports.ImportExtractor",
    "kind": "class",
    "path": "L:\\AIOS\\tools\\codegraph_mapper\\cgm\\imports.py",
    "name": "ImportExtractor",
    "qualname": "cgm.imports.ImportExtractor",
    "span": {
      "start": {
        "line": 9,
        "col": 0
      },
      "end": {
        "line": 79,
        "col": 34
      }
    },
    "doc": "Extracts import relationships from AST",
    "meta": {
      "decorators": []
    }
  },
  {
    "id": "class:cgm.laws_gate.LawsGate",
    "kind": "class",
    "path": "L:\\AIOS\\tools\\codegraph_mapper\\cgm\\laws_gate.py",
    "name": "LawsGate",
    "qualname": "cgm.laws_gate.LawsGate",
    "span": {
      "start": {
        "line": 11,
        "col": 0
      },
      "end": {
        "line": 80,
        "col": 33
      }
    },
    "doc": "Enforces SCP-001 laws for CGM tool",
    "meta": {
      "decorators": []
    }
  },
  {
    "id": "class:cgm.logging_util.CGMLogger",
    "kind": "class",
    "path": "L:\\AIOS\\tools\\codegraph_mapper\\cgm\\logging_util.py",
    "name": "CGMLogger",
    "qualname": "cgm.logging_util.CGMLogger",
    "span": {
      "start": {
        "line": 13,
        "col": 0
      },
      "end": {
        "line": 48,
        "col": 66
      }
    },
    "doc": "Append-only JSONL logger for CGM",
    "meta": {
      "decorators": []
    }
  },
  {
    "id": "class:cgm.report_html.HTMLReporter",
    "kind": "class",
    "path": "L:\\AIOS\\tools\\codegraph_mapper\\cgm\\report_html.py",
    "name": "HTMLReporter",
    "qualname": "cgm.report_html.HTMLReporter",
    "span": {
      "start": {
        "line": 11,
        "col": 0
      },
      "end": {
        "line": 210,
        "col": 28
      }
    },
    "doc": "Generates interactive HTML summary",
    "meta": {
      "decorators": []
    }
  },
  {
    "id": "class:cgm.report_md.MarkdownReporter",
    "kind": "class",
    "path": "L:\\AIOS\\tools\\codegraph_mapper\\cgm\\report_md.py",
    "name": "MarkdownReporter",
    "qualname": "cgm.report_md.MarkdownReporter",
    "span": {
      "start": {
        "line": 11,
        "col": 0
      },
      "end": {
        "line": 159,
        "col": 30
      }
    },
    "doc": "Generates Markdown summary report",
    "meta": {
      "decorators": []
    }
  },
  {
    "id": "class:cgm.runner.CGMParams",
    "kind": "class",
    "path": "L:\\AIOS\\tools\\codegraph_mapper\\cgm\\runner.py",
    "name": "CGMParams",
    "qualname": "cgm.runner.CGMParams",
    "span": {
      "start": {
        "line": 28,
        "col": 0
      },
      "end": {
        "line": 39,
        "col": 35
      }
    },
    "doc": "Parameters for code graph mapping",
    "meta": {
      "decorators": [
        "dataclass"
      ]
    }
  },
  {
    "id": "class:cgm.runner.CGMResult",
    "kind": "class",
    "path": "L:\\AIOS\\tools\\codegraph_mapper\\cgm\\runner.py",
    "name": "CGMResult",
    "qualname": "cgm.runner.CGMResult",
    "span": {
      "start": {
        "line": 42,
        "col": 0
      },
      "end": {
        "line": 52,
        "col": 25
      }
    },
    "doc": "Result of code graph mapping run",
    "meta": {
      "decorators": []
    }
  },
  {
    "id": "class:cgm.symbols.SymbolExtractor",
    "kind": "class",
    "path": "L:\\AIOS\\tools\\codegraph_mapper\\cgm\\symbols.py",
    "name": "SymbolExtractor",
    "qualname": "cgm.symbols.SymbolExtractor",
    "span": {
      "start": {
        "line": 10,
        "col": 0
      },
      "end": {
        "line": 116,
        "col": 20
      }
    },
    "doc": "Extracts symbols (classes, functions, constants) from AST",
    "meta": {
      "decorators": []
    }
  },
  {
    "id": "class:cgm.xref.XRefExtractor",
    "kind": "class",
    "path": "L:\\AIOS\\tools\\codegraph_mapper\\cgm\\xref.py",
    "name": "XRefExtractor",
    "qualname": "cgm.xref.XRefExtractor",
    "span": {
      "start": {
        "line": 10,
        "col": 0
      },
      "end": {
        "line": 62,
        "col": 57
      }
    },
    "doc": "Extracts cross-file reference hints",
    "meta": {
      "decorators": []
    }
  },
  {
    "id": "file:L:\\AIOS\\tools\\codegraph_mapper\\cgm\\__init__.py",
    "kind": "file",
    "path": "L:\\AIOS\\tools\\codegraph_mapper\\cgm\\__init__.py",
    "name": "__init__.py",
    "hash": "835dc0a319afa2e261b3fd2bc6ad0e8104873464882b47af8e7040fdc3326d46",
    "meta": {
      "path": "L:\\AIOS\\tools\\codegraph_mapper\\cgm\\__init__.py",
      "size": 167,
      "mtime": "2025-10-22T07:43:33.117064+00:00",
      "mime": "text/x-python",
      "sha256": "835dc0a319afa2e261b3fd2bc6ad0e8104873464882b47af8e7040fdc3326d46"
    }
  },
  {
    "id": "file:L:\\AIOS\\tools\\codegraph_mapper\\cgm\\__main__.py",
    "kind": "file",
    "path": "L:\\AIOS\\tools\\codegraph_mapper\\cgm\\__main__.py",
    "name": "__main__.py",
    "hash": "453540a482e1c93edba730997eeeb04182a63d169cb332308b846f711cae1b5f",
    "meta": {
      "path": "L:\\AIOS\\tools\\codegraph_mapper\\cgm\\__main__.py",
      "size": 114,
      "mtime": "2025-10-22T07:53:41.278015+00:00",
      "mime": "text/x-python",
      "sha256": "453540a482e1c93edba730997eeeb04182a63d169cb332308b846f711cae1b5f"
    }
  },
  {
    "id": "file:L:\\AIOS\\tools\\codegraph_mapper\\cgm\\callgraph.py",
    "kind": "file",
    "path": "L:\\AIOS\\tools\\codegraph_mapper\\cgm\\callgraph.py",
    "name": "callgraph.py",
    "hash": "b5803ff0809468efe5c0ced0a136af98af128ceb61da84e1c9298c36c166413e",
    "meta": {
      "path": "L:\\AIOS\\tools\\codegraph_mapper\\cgm\\callgraph.py",
      "size": 2833,
      "mtime": "2025-10-22T07:46:51.212190+00:00",
      "mime": "text/x-python",
      "sha256": "b5803ff0809468efe5c0ced0a136af98af128ceb61da84e1c9298c36c166413e"
    }
  },
  {
    "id": "file:L:\\AIOS\\tools\\codegraph_mapper\\cgm\\cli.py",
    "kind": "file",
    "path": "L:\\AIOS\\tools\\codegraph_mapper\\cgm\\cli.py",
    "name": "cli.py",
    "hash": "4d14bd8b4a9400e41303cf571a3817928d11d5ee35f45d6132a111b4f53eb253",
    "meta": {
      "path": "L:\\AIOS\\tools\\codegraph_mapper\\cgm\\cli.py",
      "size": 4157,
      "mtime": "2025-10-22T07:52:24.998771+00:00",
      "mime": "text/x-python",
      "sha256": "4d14bd8b4a9400e41303cf571a3817928d11d5ee35f45d6132a111b4f53eb253"
    }
  },
  {
    "id": "file:L:\\AIOS\\tools\\codegraph_mapper\\cgm\\emit_csv.py",
    "kind": "file",
    "path": "L:\\AIOS\\tools\\codegraph_mapper\\cgm\\emit_csv.py",
    "name": "emit_csv.py",
    "hash": "934dd22a70e3f1677f698780c724b788ffb73ff22b5869f6fda47b4ef6559083",
    "meta": {
      "path": "L:\\AIOS\\tools\\codegraph_mapper\\cgm\\emit_csv.py",
      "size": 3088,
      "mtime": "2025-10-22T07:48:24.677330+00:00",
      "mime": "text/x-python",